{
  "alternative": null,
  "cost": [
    {
      "item": "MUSHROOM_SMALL",
      "quantity": 25
    }
  ],
  "description": {
    "ar": "سيصبح الأتباع مغسولي العقول. ستأمن العقيدة أي تأثيرات سلبية تمامًا لمدة يومين.",
    "de": "Anhänger erhalten eine Gehirnwäsche. Ihr Glaube bleibt 2 Tage lang auf dem Maximalwert.",
    "en": "Followers will become brainwashed. Faith will be locked at full for 2 days.",
    "es": "Lávales el cerebro a tus adeptos. La fe se mantendrá al máximo durante 2 días.",
    "fr": "Vos adeptes seront lobotomisés. La foi sera verrouillée au maximum pendant 2 jours.",
    "fr-CA": "Lavez le cerveau de vos adeptes. Leur foi sera verrouillée au maximum pendant 2 jours.",
    "it": "I membri del Culto verranno condizionati. La Fede resterà al massimo per 2 giorni.",
    "ja": "すべての信者を洗脳する。2日間、信仰レベルが最高状態で固定される",
    "ko": "추종자들이 세뇌상태가 됩니다. 이틀 동안 신앙이 최대치로 고정됩니다.",
    "nl": "Volgelingen worden gehersenspoeld. Volgelingen hebben 2 dagen lang maximaal geloof.",
    "pt-BR": "Seguidores ficarão bitolados. A fé permanecerá completa por 2 dias.",
    "ru": "Последователи на время забывают о ваших промахах. Вера остаётся максимальной в течение 2 суток.",
    "tr": "Takipçilerin beyni yıkanır. İnanç 2 gün boyunca tam dolu hâlde kalır.",
    "zh-CN": "教徒将受到洗脑，信仰值将维持全满 2 天。",
    "zh-TW": "教徒將受到洗腦，信仰值將維持全滿 2 天。"
  },
  "descriptionPlain": {
    "ar": "سيصبح الأتباع مغسولي العقول. ستأمن العقيدة أي تأثيرات سلبية تمامًا لمدة يومين.",
    "de": "Anhänger erhalten eine Gehirnwäsche. Ihr Glaube bleibt 2 Tage lang auf dem Maximalwert.",
    "en": "Followers will become brainwashed. Faith will be locked at full for 2 days.",
    "es": "Lávales el cerebro a tus adeptos. La fe se mantendrá al máximo durante 2 días.",
    "fr": "Vos adeptes seront lobotomisés. La foi sera verrouillée au maximum pendant 2 jours.",
    "fr-CA": "Lavez le cerveau de vos adeptes. Leur foi sera verrouillée au maximum pendant 2 jours.",
    "it": "I membri del Culto verranno condizionati. La Fede resterà al massimo per 2 giorni.",
    "ja": "すべての信者を洗脳する。2日間、信仰レベルが最高状態で固定される",
    "ko": "추종자들이 세뇌상태가 됩니다. 이틀 동안 신앙이 최대치로 고정됩니다.",
    "nl": "Volgelingen worden gehersenspoeld. Volgelingen hebben 2 dagen lang maximaal geloof.",
    "pt-BR": "Seguidores ficarão bitolados. A fé permanecerá completa por 2 dias.",
    "ru": "Последователи на время забывают о ваших промахах. Вера остаётся максимальной в течение 2 суток.",
    "tr": "Takipçilerin beyni yıkanır. İnanç 2 gün boyunca tam dolu hâlde kalır.",
    "zh-CN": "教徒将受到洗脑，信仰值将维持全满 2 天。",
    "zh-TW": "教徒將受到洗腦，信仰值將維持全滿 2 天。"
  },
  "doctrine": "Special_Brainwashed",
  "faith": 80.0,
  "group": "secondary",
  "icon": "icons/rituals/Ritual_Brainwashing.png",
  "id": "Ritual_Brainwashing",
  "name": {
    "ar": "طقس غسل العقول",
    "de": "Ritual der Gehirnwäsche",
    "en": "Brainwashing Ritual",
    "es": "Ritual de lavado de cerebros",
    "fr": "Rituel de lavage de cerveau",
    "fr-CA": "Rituel de lavage de cerveau",
    "it": "Rito del condizionamento",
    "ja": "洗脳の儀式",
    "ko": "세뇌의 의식",
    "nl": "Hersenspoelritueel",
    "pt-BR": "Ritual de Lavagem Cerebral",
    "ru": "Промывание мозгов",
    "tr": "Beyin Yıkama Ayini",
    "zh-CN": "洗脑仪式",
    "zh-TW": "洗腦儀式"
  },
  "namePlain": {
    "ar": "طقس غسل العقول",
    "de": "Ritual der Gehirnwäsche",
    "en": "Brainwashing Ritual",
    "es": "Ritual de lavado de cerebros",
    "fr": "Rituel de lavage de cerveau",
    "fr-CA": "Rituel de lavage de cerveau",
    "it": "Rito del condizionamento",
    "ja": "洗脳の儀式",
    "ko": "세뇌의 의식",
    "nl": "Hersenspoelritueel",
    "pt-BR": "Ritual de Lavagem Cerebral",
    "ru": "Промывание мозгов",
    "tr": "Beyin Yıkama Ayini",
    "zh-CN": "洗脑仪式",
    "zh-TW": "洗腦儀式"
  },
  "sin": 0,
  "trait": "MushroomEncouraged",
  "warmth": 0.0
}
